string2 0,string 1,string 2,string 3
"f_d0604_0400_0020","char_APOLLOMON","Forgive me, but would you mind searching for the device
for me? I cannot leave Nervy here while she is so weak.",""
"f_d0604_0410_0010","char_DIANAMON","I heard that those taken from their cells never return.",""
"f_d0604_0410_0020","char_DIANAMON","I cannot allow anything to happen to Minnie. I must stay
here and stand guard.",""
"f_d0604_0420_0010","char_RANAMON","Hm? It's finally over? Phew, that sure was scary...",""
"f_d0604_0420_0020","char_RANAMON","What was with that shark?! It just kept chomping at everyone!",""
"f_d0604_0420_0030","char_RANAMON","*sigh* This has all been too much for me. I need a rest.",""
"f_d0604_0430_0010","char_TUNOMON_TITAMON","Where're you going, kid? We have to find the Gamma Device.",""
"f_d0606_0010_0010","char_TAILMON","Do you want to ride the Locomon Railroad?",""
"f_d0606_0010_0020","char_PLAYER_M","Yes, please!",""
"f_d0606_0010_0021","char_PLAYER_M","Not right now.",""
"f_d0606_0010_0030","char_TAILMON","The train will pull into the station momentarily. Please
wait until it comes to a complete stop.",""
"f_d0606_0010_0040","char_TAILMON","We look forward to serving you again.",""
"f_d0606_0010_0050","char_TAILMON","We heard everything. Lady Junomon is guarding something 
important in this temple and is unable to leave.",""
"f_d0606_0010_0060","char_TAILMON","People consider the Relic of Iliad to be a great treasure.
That's why there's a barrier in order to keep it safe.",""
"f_d0606_0010_0070","char_TAILMON","We received permission to travel to the Gear Forest.
Are you ready to go?",""
"f_d0606_0020_0010","char_ANGEWOMON","I bid you welcome. I am the caretaker of this temple.",""
"f_d0606_0020_0020","char_ANGEWOMON","Junomon is within. If you have business here, you may
proceed inside.",""
"f_d0606_0030_0010","char_CORONAMON","I'm so jealous of you. I want to visit all kinds of different
places, too!",""
"f_d0606_0040_0010","char_LUNAMON","I bet you must be really tired! But go ahead on in.",""
"f_d0606_0050_0010","char_MUMMYMON","The Guardian Palace where Lady Junomon resides
is protected by a special barrier...",""
"f_d0606_0050_0020","char_MUMMYMON","As a result, it is only accessible via the Locomon Railroad.
We can journey there now that it's running again.",""
"f_d0606_0050_0030","char_MUMMYMON","Are you ready to board?",""
"f_d0607_0010_0010","char_JUNOMON","I connected this gate to the place where Chronomon is. 
However, a space-time distortion has already arisen...",""
"f_d0607_0010_0015","char_JUNOMON","I have tried to eliminate any possible side effects, but it may 
take some time before you emerge on the other side.",""
"f_d0607_0010_0020","char_JUNOMON","Please, if anyone can stop Chronomon, it is you...!",""
"f_d0607_0010_0030","","{next}[Enter the gate.]",""
"f_d0607_0010_0031","","{end}[Don't enter.]",""
"f_d0608_0010_0010","char_JUNOMON","Observe the state of this world with your own eyes. See just
how dire our need for the Great Guardian has become.",""
"f_d0608_0010_0020","char_JUNOMON","Please proceed to the Abyss Area at once. I beseech you
to return peace to our threatened seas.",""
"f_d0608_0010_0030","char_JUNOMON","With that, Aegiomon, I leave it to you. And you as well,
children of man...",""
"f_d0608_0010_0040","char_JUNOMON","The World Tree is at the center of the Current. You will find
the enemy's forces concentrated there more than ever before.",""
"f_d0608_0010_0050","char_JUNOMON","Please be careful. I shall pray for your safety, Great
Guardian Aegiomon.",""
"f_d0609_0010_0010","char_OPERATOR_M","What's the matter? Are you okay?! You mustn't give up!",""
