key,text
"digimon_0580_profile","A species of Ogremon that lives in cold regions. 
Hyogamon is extremely territorial, flying off the handle
and attacking anyone who takes even a step inside its 
domain (even getting into occasional clashes with 
Mojyamon over territory). Its special move is Snow 
Punch, which unleashes a chilling blow."
"digimon_0582_profile","A larval Digimon whose epidermis has yet to
solidify due to it living underwater. Otamamon
swims through swamps and rivers upstream of the
Net Ocean using its large tail, occasionally
clambering onto rocks with its developed forelimbs
to do vocal exercises. Unlike those of an average
organism, its hind legs are almost completely
undeveloped, acting as rudders in the stead of its
propulsive tail. Unlike other Rookies, this Digimon's
future Digivolution seems quite promising, but it's
extremely prone to mutation, so caution is
warranted when raising it. Otamamon's special
move is Lullaby Bubble, which sends opponents
into an eternal slumber."
"digimon_0584_profile","A reaper-like Digimon wielding a giant sickle and
chain. A Ghost Digimon more advanced than
Bakemon, once Phantomon possesses an individual,
their fate is almost certainly sealed. The eye-shaped
crystal hanging from its neck functions like
Mammothmon's crest, providing it with a second sight
that allows it to see over long distances. Phantomon
uses this ability to find those on the verge of death.
It's said that the inside of the cloth concealing its body
is connected to the Digital World of another dimension.
Phantomon's special move is Soul Chopper, which uses
its giant sickle and chain to slash its opponent's very
soul. Anyone struck by this attack is completely
obliterated, soul and all."
"digimon_0586_profile","A brutal Insectoid Digimon with massive wings. These 
wings allow Flymon to skirt through the air at ultrahigh 
speeds, creating sonic booms called ""Howling Noise"" 
in its wake that rob unlucky victims of their hearing. 
Its body is protected by a tough carapace, and it 
pinches foes with its huge talons before killing them 
with the extra-potent venomous stinger on its tail. The
Digivolution process of Insectoid Digimon is still 
unknown, but from its face, some have surmised that
Flymon originally Digivolved from a Kunemon-type 
creature. Its special move is Brown Stingers, which 
shoots a stinger from its tail that completely paralyzes 
the Digimon it pierces, turning it purple before ending 
its life. Incidentally, this nasty stinger can be regrown 
over and over again."
"digimon_0588_profile","An Ancient Digimon proved to have existed in ages 
long past, thanks to a multitude of evidence. The 
warming of the Digital World defrosted some
hyper-compressed data, causing Mammothmon to 
appear in icy areas where the thaw had melted. Its 
whole body is covered in thick fur, and although this 
Digimon possesses tremendous ancient power, it's
extremely susceptible to fire damage. The crest 
carved onto Mammothmon's face mask is a crystal
of super-ancient wisdom, and it possesses a second 
sight that allows it to see long distances. Its large
ears can discern sounds even in far-off places. 
Mammothmon's special move is Tusk Strikes, which 
stabs at the enemy with its two long tusks."
"digimon_0590_profile","An Undead Digimon whose muscles have rotted off. 
Raremon tried to prolong its life by mechanizing itself, 
but the process was unstable, causing the data 
composing its body to start falling apart. Even so, its 
machine parts grant this creature life, preventing its 
death and allowing it to survive in this awful state.
This crumbling form affords neither attack power nor 
intelligence, making Raremon act according to instinct
alone. Its body emits a stench awful enough to send 
In-Training Digimon running, and it won't fight
anything below Champion level."
"digimon_0592_profile","A cursed Digimon in the shape of a spider, whose 
entire body is infested with a computer virus. Even 
though a spider-species type, Dokugumon was
originally a gentle and quiet Insectoid Digimon. 
One day, however, it was caught in a powerful
electromagnetic storm, and was infected with a 
computer virus that had been lurking around the Net. 
From that moment on, it became one big lump of 
venom—in other words, a nasty computer virus, 
corroding everything it touched. Dokugumon's 
eight-legged mobility is worthy of special mention, 
too. Even if the enemy runs from it at full speed, this 
Digimon will be right on its heels, pursuing it until it 
tires itself out. And then, as soon as it stops to take a
rest, Dokugumon uses Venom Blast on it, unleashing 
a dreadful, venomous attack from its fiendish fangs."
"digimon_0594_profile","A Sea Animal Digimon with fins on its feet with
which to paddle through water. Gizamon is more
suited to life underwater than on land, using its fins
and strong hind legs to swim quickly through aquatic
areas. On land, however, it bounces around like a
frog. Gizamon acts cowardly on land, but displays
a ferocious disposition once back in the water. Its
special move is Spiral Edge, which attacks foes
with its sharp-edged dorsal fins."
"digimon_0595_profile","An Ore Digimon with powerful defensive abilities,
having armored itself using ore data from its
surroundings. As spunky, mischievous and
ambitious as any young tough guy, Gotsumon
leads around groups of low-generation Digimon
as it travels the system. It also has a selfish side,
and can be a real handful when angered, rampaging
like an erupting volcano. The ore data Gotsumon
uses for its armor differs depending on where and
how it was generated, giving Gotsumon the
potential to Digivolve into a number of different
forms. Gotsumon's special move is Rock Fist, which
shoots extremely hard rocks from its head."
"digimon_0596_profile","A stuffed animal Digimon with a pumpkin for a head. 
According to urban legend, Pumpkinmon was created
when a computer virus commonly circulated around 
Halloween time suddenly mutated. The virus wasn't
malicious, so this Digimon never harms people, but 
Pumpkinmon is quite strong despite its appearance. 
As one look at their blankly staring faces will tell you, 
Puppet Digimon tend not to express emotion very 
clearly, and Pumpkinmon is no exception. Its special 
move is Trick or Treat, which manifests a giant 
pumpkin in midair with which to crush its foes."
"digimon_0597_profile","An experimental Digimon built in a laboratory as a 
Virus Hunter. Made of praying mantis data, Snimon 
chases after its target with machine-like precision. 
Its cold personality makes it feared by both Vaccine
and Data-attribute types alike. The scythes on
Snimon's arms are sharpened to points, allowing 
this Digimon to cleave cleanly through anything. It 
has no eyes, but the red feelers on its head act as 
sensors to accurately track the target's position. 
Snimon's special move is Shadow Sickle, which 
unleashes a supersonic slash invisible to the naked 
eye."
"digimon_0598_profile","A super heavy Dinosaur Digimon with giant horns 
growing from its shoulders. Tuskmon's foolhardy
personality means it will charge at and destroy every 
obstacle in its path, earning it the nickname of the
""Panzer Digimon."" Specializing in charging tackles, 
Tuskmon has made countless Digimon fall before its
attacks. The stars on its arms represent the number 
of Digimon that Tuskmon has defeated (one hundred 
per star). If its horns break, it can shed them like 
shark teeth and bring new horns from the back to the 
front, making any attempt to destroy its horns fruitless.
Tuskmon's special move is Slamming Tusk, which
unleashes a super dreadnought-class punch."
"digimon_0600_profile","The true, Digivolved form of the king of the undead,
Myotismon. VenomMyotismon is a demon with the
lower body of a beast and an insect-like carapace
on its upper body. Having unleashed the full extent
of its hidden power, it yearns only for death and
destruction. Myotismon, retaining its reason,
intellect and refined conduct, is loath to reveal this
repugnant form. VenomMyotismon's special move
is Venom Infusion, which injects its opponent with
a destructive virus that completely destroys its
configuration data, causing it to cease functioning."
"digimon_0601_profile","A Digimon resembling a witch, who pursued its rival,
Wizardmon, from Witchelny, the Digital World of
another dimension. Witchmon mastered the magics
of wind and water (advanced programming languages)
in its home dimension Witchelny, but then pursued 
Wizardmon to the Digital World and now trains 
vigorously in order to get a leg up on this rival that
aims to become a great mage. Witchmon has a bit of 
a cruel streak, more than a bit of pride and loathes
both convention and established routines.
Witchmon's special move is Baluluna Gale, which
unleashes a cutting wind imbued with magic power."
"digimon_0602_profile","A Magic Warrior Digimon from Witchelny, the Digital 
World of another dimension. In addition to the
multitudes of magic (advanced programming language) 
at its disposal, Mistymon is also adept at the blade, 
possessing masterful swordsmanship. Well-versed 
both in chivalry and sorcery, it can even imbue its
sword with magic to attack. Its special move Blast
Fire is one such form of magic by which it covers
its sword in flames to slash with enhanced might."
"digimon_0603_profile","A Warrior Digimon extolled as the legendary hero of 
Witchelny, the Digital World of another dimension.
Ancient Witchelny was on the path to ruin, since its 
magic (advanced programming language) was still 
in its infancy and it lacked techniques to protect the 
land from invasion by outside forces. It's said that
MedievalGallantmon suddenly appeared and repelled 
invaders, and that it transcends time to exist to the
present day, although the truth of this is uncertain. It 
fights with arms created with magic, and wields
Dynas, the ultimate magic lance concealing the power 
of the wyvern. MedievalGallantmon is nicknamed the
Whirlwind General due to its governance over the 
Vortex Warriors, Digimon who fight with weapons 
made of wind magic, one of the four magic types (fire, 
earth, water and wind). Practically none have seen
MedievalGallantmon in the Digital World, but this 
Digimon is known as the Warrior of Fantasy due to its
armor covered with gorgeous decoration, and is a 
solemn figure affixed with a coat of arms.
MedievalGallantmon uses special move Rage of 
Wyvern to fire energy from Dynas."
"digimon_0604_profile","A mythical Galaxy Digimon said to have appeared 
when an unprecedented crisis descended upon the 
Digital World Iliad. The collision of the opposing 
forces of solar energy and lunar energy cause 
GraceNovamon to generate Big Bang levels of energy
within its body. It came into being when Apollomon 
and Dianamon of the Olympos XII fused together. 
As a result, GraceNovamon itself is believed to be a 
galaxy in its own right, and the full extent of its data is 
impossible to measure accurately. Its special moves 
are Eclipse Finger, which concentrates the energy 
amplified within its body into its hands, causing foes 
to melt when it touches them, and Calydon Arcus, 
which fires the eight Meleagros blades on its back to 
seek out and destroy its foes."
"digimon_0605_profile","A research data bank used to investigate and excavate 
ancient lifeforms was infected by a computer virus, 
which then incorporated data about these lifeforms 
into itself to Digivolve. Scorpiomon possesses a 
voracious appetite and predatory skills befitting a 
creature that stands at the top of an ancient food 
chain. It captures foes with the feelers growing from 
its head, then finishes them off with the sharp blade 
sprouting from its tail. If the tide of battle turns
against Scorpiomon, it can churn up the seabed with
its sharp feelers in order to hide. It uses the Radar Eyes 
protruding from its head like night vision goggles to 
ascertain foes, and then aims for a chance to strike.
Scorpiomon's special move is Stinger Surprise, which 
launches an attack from its crossed forelimbs."
"digimon_0606_profile","An Aquatic Beast Man Digimon clad in a wetsuit.
Cheerful by nature, Divermon can always be found
swimming in the Net Ocean. Underwater movement is
its forte, and it uses the underwater high-speed motor
on its back to engage in speedy combat. Divermon's
special move is Strike Fishing, which stabs the enemy
with its beloved harpoon, ""Trent."""
"digimon_0607_profile","A small Vegetation Digimon in the shape of a poisonous
mushroom. Tiny but potent poisonous mushroom
bombs growing from Mushroomon's body cause
all kinds of afflictions. Anyone hit by one of these
bombs could start laughing uncontrollably, have
their body go numb, lose their memory, or worse.
Mushroomon is extremely ill-tempered and
enjoys picking on the weak, but also has a shy
side, always hiding half of its face. Its special
move is Fungus Crusher, scattering multiple
mini-mushroom bombs at once."
"digimon_0609_profile","An extremely rare insect Machine Digimon that
was recently discovered. No insect Machine
Digimon had been discovered up to that point, and
so Kokuwamon's existence wasn't even considered
a possibility. Its stun gun-shaped head and arms
can discharge 100 megavolts of electricity when it
senses danger, so none can approach without
caution. Even so, Kokuwamon lacks any aggression,
sporting instead an accommodating nature that
seeks peace. Kokuwamon obtains nourishment
from electricity, and recharges itself with the two
limbs on its midsection. Its special move is
Mini Scissor Claw, which electrifies its pincers
to slice through even the sturdiest of objects."
"digimon_0610_profile","A mysterious Ancient Digimon said to have been 
hunted to extinction due to the proliferation of the 
Internet. The wings of this Bird Digimon have
completely degenerated, preventing it from taking 
flight. Kiwimon also bears some aspects of a 
Vegetation Digimon, with leaf-like objects growing
from its head that it uses to absorb nutrients through
photosynthesis. It has no way to defend itself aside 
from the hard shell covering its head, and its docile 
personality makes it an easy target. Kiwimon's special 
move is Pummel Peck, attacking with the ChibiKiwimon 
hidden in its body. The beaks of the ChibiKiwimon are 
just as hard as Kiwimon's, and they explode when 
struck. Even if this explosion chars them to a crisp,
ChibiKiwimon will always bounce back."
"digimon_0611_profile","A rare Digimon that, like Palmon, Digivolved in
reptilian fashion but is classified as a Vegetation
Digimon. The entirety of Floramon's face is shaped
like a flower, and it generally uses this petal-like
shell like a helmet to protect its head. When no
predators are around, or when in a good mood, it
will spread open the petals on its head and arms.
Floramon sees Palmon as a rival, and has a very
high opinion of itself. Its special move is Rain of
Pollen, which releases clouds of allergy-inducing 
pollen from the flowers on its arms. Anyone hit by
this attack—even a large Digimon—will be robbed
of both their composure and will to fight."
"digimon_0613_profile","An Angel Digimon protecting the Zenith Gate that 
connects the Digital World to the outside world. This 
gate is sealed by 360 doors, and ClavisAngemon holds 
""The Key,"" a master key that unlocks them all. The Key 
is special in that it can only be wielded by this Digimon. 
Some suspect that ClavisAngemon itself is a part of 
said key. The power embedded in The Key could 
apparently collapse the very Digital World itself, but is
only used against foes who would destroy the doors."
"digimon_0614_profile","A Great Angel Digimon that leads the angel army and 
takes the lead in battle. SlashAngemon doesn't fear
death when in the service of carrying out justice. 
From its twin arm blades to its metal wings, the 
razor-sharp body of this angel warrior was without a 
doubt born to battle wicked beings. SlashAngemon's 
signature move is Blade of the True, and its special
move is Golden Ripper, charging at foes with 
tremendous force to carve them up with the blades 
on its body."
"digimon_0615_profile","A power suit Digimon used by other, small-sized 
Digimon, making it the first Vehicle-species Digimon 
in the Digital World. Mekanorimon is unique in that 
it can't operate itself, and fails to function unless 
piloted by other Digimon. Given its Virus attribute, 
the Digimon controlling it can also be considered a
Virus Digimon. Mekanorimon is still in development,
meaning its DigiCore will overheat if it's used too 
much. Its special move is Twinkle Beam, which fires 
a beam from the linear lens embedded in its torso.
Any enemy hit by this beam loses control of their
body."
"digimon_0616_profile","A Dragon Man Digimon fortified with firearm 
contraptions all over its body. A wanderer traveling 
the Digital World in search of its scattered comrades, 
MagnaKidmon is a troublemaker that causes 
problems and gets caught up in incidents wherever
it ends up. Its self-centered personality often makes 
it single-minded, but its sense of friendship and 
obligation runs deep. MagnaKidmon befriends any 
local Deputymon it comes upon, mistaking them for 
its brethren. This trigger-happy creature loves
one-on-one combat, firing bullets indiscriminately 
once challenged to a duel. One of MagnaKidmon's 
special moves is Bind Red Trigger, which stabs the 
small machine guns attached to its hip-mounted 
magazines into the opponent, destroying it from 
within. Its ultimate special move is Happy Bullet 
Showering, which sends MagnaKidmon high into the 
skies with its winglike scarf to target the opponent 
with folded arms, pounding away at it with a mix of 
live ammo and plasma projectiles from its fingertips 
and gun muzzles on both legs."
"digimon_0617_profile","The result of a sudden transformation akin to 
mutation that occurred when a Digimon felled by 
MagnaKidmon became so obsessed with revenge 
that the data of its own negative thoughts
overwhelmed its DigiCore. To vent its rage at taking 
on an appearance so similar to the Digimon it hoped 
to destroy, AvengeKidmon has turned to mindless 
rampage, to the extent that its original goal of 
defeating MagnaKidmon has left its thoughts. One of 
its special moves is Destruction Trigger, which pins 
an enemy underfoot before firing an explosive bullet 
into them at point-blank range from its gun leg,
regardless of the fact that this will injure 
AvengeKidmon as well. The other is Misery Bullet 
Rain, which launches its target into the air with a 
stream of energy blasts from its fingers, then 
unleashes a barrage of live ammunition while it's still 
in midair."
"digimon_0621_profile","An Android Digimon resembling a tank. Known as the 
""Mercenary Digimon,"" Tankmon will back up Vaccine 
and Virus Digimon alike if there's profit to be made. 
It pulverizes incoming enemies to dust with its 
heavyweight power and the heavy ordnance covering
its body. A conflict enthusiast, Tankmon heads in the 
direction of any strife that pops up. Wherever this
lone wolf goes, conflict is sure to continue unceasingly.
Tankmon's special move is Hyper Cannon, which
launches a super-powerful missile from the gun
barrel on its head."
"digimon_0622_profile","A Bird Digimon resembling a penguin found in the
computer of an Antarctic base. Since Penmon lives
in snow-covered regions, it doesn't do well in the
heat. It does quite well with humans, conversely,
and will happily waddle along behind them. Penmon's
wings have degenerated, so it can't fly or walk
very quickly. But when it slides across the ice on
its belly, it can reach speeds close to 40 mph.
When in the water, Penmon can use its small
wings to skillfully swim around. Its special move
is Super Slap, where it sneaks up on the enemy
to smack their cheeks as hard as it can with
both arms."
"digimon_0623_profile","A flightless Bird Digimon that's the spitting image
of Penmon. Raised in tropical lands to the south,
Muchomon lives a life of constant cheer. It overflows
with passion, dances to a samba beat and loves
its vivid, richly-colored pelt. Muchomon's special
move is Tropical Beak, pecking the opponent
with its colorful beak."
"digimon_0626_profile","Keramon is a Rookie Digimon that Digivolved
from Tsumemon. Now that its body has grown
larger and its mouth is bigger, it can devour
more data. Keramon is capable of consuming
more than 100 megabytes per second, and most
data is destroyed the instant Keramon accesses it.
Extremely playful by nature, it thinks of its
destructive acts as a kind of game. Its special
move is Crazy Giggle, with which it unleashes a
highly destructive beam of light from its mouth
as it laughs—if you can call it laughing."
"digimon_0627_profile","An Ultimate Digimon similar in appearance to a 
long-legged spider. In its normal form, Infermon has 
its limbs and head extended, but it can also take on 
a cocoon form where it draws its limbs inside its body. 
In cocoon form, its defense increases to the point 
where it can repel any attack, although this limits its
movement to a straight line. It can easily overcome 
the tightest security to infiltrate any network. Should
Infermon ever be released onto the Net, the world 
would be plunged into chaos. Its special move Spider
Shooter fires an energy bomb of incredible destructive 
power from the gunport in its mouth."
"digimon_0629_profile","Kuramon is an Unidentified Digimon that suddenly 
appeared on a computer network. A single Digi-Egg 
was born from the malice of humans abusing
computers and the aggression from conflicts
unfolding over networks. The Digi-Egg was the 
amalgamation of humanity's destructive instincts,
and the mysterious Digimon born from it is incredibly
dangerous. It multiplies within a computer network
like a virus, causing minor network failures. Kuramon 
uses its special move Glare Eye to produce a frothy
substance from its giant eye."
"digimon_0630_profile","Kurisarimon is a Champion Digimon that resembles a
chrysalis. In order to Digivolve into a more powerful
form, the Rookie Keramon temporarily enters a
chrysalis state to store up its energy. As a result, it
becomes completely unable to move, but its tough
outer hide protects it while the tentacles that grow
from its back allow it to attack foes. Keramon can
sometimes Digivolve directly into an Ultimate Digimon
without going through this Champion phase, but
Digivolving into Kurisarimon allows it to reach a
more powerful Ultimate form. Its special move Data
Crusher involves using the tentacles that extend from
its back to destroy an enemy's composition data."
"digimon_0631_profile","An In-Training Digimon that Digivolved beyond
Kuramon. The tips of its feelers are shaped like
talons, increasing its ferocity. Tsumemon corrodes 
data at frightening speed, causing networks to
malfunction. Its movement speed is just as fast,
making this Digimon difficult to catch once it's
Digivolved to this level. It uses its special move
Nail Scratch to rake the enemy with the talons on
its feelers."
"digimon_0632_profile","Diaboromon absorbs any and all data on the Net 
so that it can repeatedly Digivolve and grow larger, 
thereby draining the Digital World and bringing it to 
the brink of destruction. Having absorbed a vast
quantity of knowledge and data, Diaboromon sees 
itself as omniscient and omnipotent, and revels in 
carnage and slaughter. Out of the many Digimon in 
existence, it's one of the few with a definite purpose. 
Its ultimate goal is to hijack a military computer so 
that it can launch a nuclear strike and destroy the 
real world, making it a terrifying Digimon. Its special 
move is Catastrophe Cannon, with which it fires a 
destructive energy bomb from the cannon in its chest."
"digimon_0669_profile","A Digimon whose power over fire exceeds that of 
legend due to the unknown powers it obtained by 
fully inheriting the might of the Ten Legendary 
Warriors. Aldamon is a Demon God who transforms 
fear and anger into a righteous power to fight. Its 
violent behavior earns it many enemies, but its 
name reflects the fused form of a god in Hindu
mythology, combining the wildness of a beast with 
the intelligence of a human. In battle, it unleashes
attacks over incredibly large areas, melting and 
burning everything to a crisp. This aspect is a 
destructive power akin to the threat of a modern
nuclear weapon. Aldamon uses its special move 
Atomic Inferno to fire a rapid-fire stream of
super-hot bullets from the Rudriya Darpana
superweapons on its arms. It can also use its
Rudriya Darpana for melee, and specializes in
close-range combat."
"digimon_0670_profile","A Digimon whose power over light exceeds that of 
legend due to the unknown powers it obtained by 
fully inheriting the might of the Ten Legendary 
Warriors. Beowolfmon possesses both the instincts
of a beast and the intelligence of a human. 
A warrior of exceptional strength, it easily wields its
twin-bladed greatsword Trinität with just one hand. 
In battle, it always remains thoughtful and composed,
although as a warrior, it believes in the virtues of 
fighting for its friends and facing off against greater 
foes. Thanks to the long-distance missile pod on its 
left arm, the Roland 2, it excels at both long-range 
and close-range combat. Its special move is
Zweihänder, an attack with which it swings the 
greatsword Trinität down at near-lightspeed to cleave 
through foes."
"digimon_0675_profile","A transcendent Digimon with power over light, 
said to even surpass the might of the Ten 
Legendary Warriors. Its special move is 
Starlight Velocity, with which it accelerates to 
superluminal speed, erasing anything that comes 
into contact with its light."
