key,text
"digimon_0168_profile","A member of the Olympos XII, a god that presides 
over the heavens, and a Digimon that governs 
thunder and weather. Jupitermon always judges
good and evil on the battlefield, delivering divine 
punishment to the wicked. Such judgment is handed 
down indifferently, without emotion. Those who 
disagree with Jupitermon's decision can challenge 
it and overturn the judgment upon victory, but, as of 
now, no one has ever accomplished this feat. It can 
clap the hammers on both arms together to summon 
small thunderclouds. It uses Punish Judge to strike 
an opponent with its hammer, engraving a mark on 
its body and postponing its punishment. When 
Jupitermon decides to execute said punishment, 
the sentence is carried out by striking that foe with 
extremely high-voltage lightning. It uses its ultimate 
special move Wide Plasment to change its body 
into ultra-high-voltage plasma. This inflicts divine 
punishment in the area around Jupitermon, 
disintegrating any and all it touches."
"digimon_0169_profile","An entirely changed version of Jupitermon, who is 
typically objective and in control of its emotions 
when dealing judgment, but has become unable 
to quell its anger when facing an enemy that has
committed an unforgiveable sin. Jupitermon: Wrath 
Mode summons its godly blade Keraunos with a 
loud roar, and its body grows dozens of times larger 
in size as armor and lightning envelop it from head 
to toe. Its rage is made evident by the violent 
lightning that surrounds it, yet the efficient calm of 
its movements exerts an incredible pressure upon 
its enemy. Jupitermon: Wrath Mode's special move 
Lightning Beam summons lightning to strike where 
it points its finger. It can also call upon the heavens 
to cast judgment on its defeated enemy with Dios 
Thunder. If the attack hits, the enemy is judged as 
guilty, and if it misses, they're not guilty. Digimon
judged as guilty by the attack have their data 
completely destroyed."
"digimon_0170_profile","Jupitermon's partner, and one of the Olympos XII. 
Junomon takes its place on the battlefield as 
Jupitermon's loving protector, and is constantly
seeking to predict, detect and root out insurgents 
who would defy Jupitermon's will. It has a solid grasp 
on all of Jupitermon's tendencies, perhaps due to its 
overwhelmingly affectionate nature and deep love 
of Jupitermon. Junomon's special moves are Needle 
Hive, which skewers foes with the katars on its arms, 
and Graceful Lance, which automatically attacks 
foes around it with its sentient lances."
"digimon_0171_profile","Another form awakened from the depths of 
Junomon's heart, one that is evil. Unceasing 
opposition to its beloved Jupitermon steals away 
the time the two of them spend together, causing 
Junomon to be consumed by envy. As the vitality 
gradually leaves its countenance, it's completely 
consumed by darkness instead. Eventually, 
Junomon reveals a new, masked face. Through this 
mask, Junomon perceives all Digimon around it to 
be evil and does everything it can to slaughter them. 
However, Jupitermon can't sense this form of 
Junomon, so it never has to face Jupitermon's 
judgment. Junomon: Hysteric Mode's special moves 
include Welcome Demise, with which it successively 
stabs the enemy with the lances of both arms, and 
Chain Lash, with which it wraps its enemy's entire 
body in chains and destroys it after forcing it to 
confess its sins."
"digimon_0172_profile","This compassionate Digimon governs the power of 
love, and is one of the Olympos XII. Even in the most
desolate wastelands, wherever Venusmon goes, 
beautiful flowers bloom and the earth around it is
renewed with youthful vigor. Many Digimon worship 
Venusmon because of its beauty and purity. By 
wearing a blindfold, it's able to perceive the world 
as it truly is with its mind's eye, seeing through any 
falsehood or deceit. Hiding its eyes also suppresses 
its aura of glamor, doubling as an act of consideration
and reducing the number of Digimon that would 
otherwise swoon in its presence. Venusmon has 
two small but constant companions, the bird Olive
and the scallop Hotan, and the three friends keep 
up an open and lively conversation. Since Venusmon 
is the Digimon that governs love, its every action in 
battle soothes its opponents' hearts. With LOVE 
YOU, it can make a foe fall unconscious by blowing 
it a kiss and making its heart skip a beat. If its bird 
Olive pecks an enemy on the head, it falls under the 
spell of Peace Fantasia, which can soothe the heart 
of even the most savage of beasts."
"digimon_0173_profile","One of the Olympos XII, and a Deity Digimon that 
possesses flame energy equivalent to the very 
sun's power. This awesome strength, capable of 
melting down and purifying any substance, is such 
that even Apollomon—with all its intense fervor 
and pride—can barely contain it. Apollomon's 
special moves are Sol Blaster, which unleashes 
an incandescent solar orb formed from the flame 
sphere on its back, and Phoebus Blow, which 
concentrates all of its latent power into a single
punch."
"digimon_0174_profile","This war god Digimon resembling a leopard 
humanoid is one of the mysterious Olympos XII, 
who possess abilities rivaling even the Royal
Knights, guardian deities of the Net. Each of the 
Olympos XII protects its own region, acting in 
the shadows and maintaining a neutral position 
during incidents in the Digital World. Marsmon 
well understands all hand-to-hand techniques 
in the world—including skills utilizing foul
play—and possesses absolute confidence in 
any one-on-one fight against those like itself. 
It relies mostly on wrestling moves, but its
focus on victory and glory means it will whip out 
hidden weapons like its Tria Knuckles or Metal 
Cothurnus when it finds itself on its back foot.
Even so, Marsmon brings its true power to bear 
when fighting with bare hands and feet. Its 
special move is Corona Sanctions, with which 
it engulfs itself in flames for a glorious mid-air 
killing technique."
"digimon_0176_profile","One of the Olympos XII, Ceresmon is a gigantic 
bird Digimon that bears the forest Karpos Hulē on 
its back. Karpos Hulē is where the most delectable 
sweets in the Digital World can be found, and 
many famous fruits grow there as well. With a body 
composed of giant rocks and fertile soil, Ceresmon 
in flight resembles a floating island more than
anything else. Ceresmon Medium, which is 
Ceresmon's true form, resides at the head of the 
island. Ceresmon Medium possesses almost no 
combat ability and rarely appears before others. 
However, on rare occasions, it apparently shows 
itself to those it trusts without bringing along the
giant bird. Ceresmon Medium has a gentle 
personality and a heart overflowing with compassion. 
It offers hungry Digimon fruits from Karpos Hulē, and 
allows injured Digimon to take shelter in the forest 
until they've recovered. However, if any prove 
ungrateful for the bounty of nature, bring harm to 
the trees or defile the land for sport, Ceresmon 
Medium's nature shifts and it becomes a truly 
frightful forest demon. Ceresmon's special move is 
Island Freefall, with which it slams its massive body 
directly into its foe, sending powerful tremors and 
violent winds surging in a wide berth around the crash 
site. Ceresmon also has Burning Blood Shell, which 
shoots a huge, scorching ball of magma from its 
mouth."
"digimon_0177_profile","BlueMeramon is a Fire Digimon that burns hotter 
than a Champion Meramon. Its special move is
Cold Flame."
"digimon_0178_profile","This Digimon god of smithing is one of the Olympos 
XII. Vulcanusmon is responsible for creating most 
of the Digital World's best-known weapons,
including the infamous Beelzemon's beloved 
Berenjena. Vulcanusmon has the spirit of a true 
craftsman, along with an obstinate personality. It
takes the measure of all of its clients, and if it feels 
they can't master or won't treasure the weapon
they've requested, it denies them. Even when 
Vulcanusmon does agree to make a weapon, it 
aligns the quality of its work to its impression of the
wielder. Nevertheless, Vulcanusmon was so taken 
with Beelzemon's strength that it worked diligently 
to craft an exceptional weapon when it created 
Berenjena. Vulcanusmon prefers to be left in peace, 
working away with its eight arms, but can also 
leverage its skill as a craftsman in battle. With its 
special move Pinpoint Weapon Works, it makes 
masterful use of its fiery ""Bomber Art"" welder to 
instantly craft the perfect weapon for any combat 
situation. When it really wants to go all out, though, 
it uses Appropriate Works, which uses Pinpoint 
Weapon Works repeatedly to forge weapons for each 
of its eight arms. Despite all this, Vulcanusmon's 
own combat ability isn't particularly high, and it 
prefers to avoid battle whenever possible."
"digimon_0179_profile","One of the Olympos XII, this Digimon boasts that 
it's the heaviest drinker of the Digital World. 
Bacchusmon has a cheerful disposition and is
well-suited to looking after others. Day or night, 
it always looks to gather Rookie and Champion 
Digimon together to throw a party. Bacchusmon
has the ability to produce any form of alcohol 
inside its body, and if it takes a liking to another 
Digimon at one of these parties, it's known to
offer it the drink of its choice. Bacchusmon itself 
has a taste for fruit wines, with its favorite variety 
produced from the fermented sweets of Karpos 
Hulē, the forest carried on Ceresmon's back. 
Whenever Bacchusmon has a moment to spare, 
it begs Ceresmon to make it some fruit wine. 
Because of this, the pair are on very good terms, 
and are often seen together. Bacchusmon's special
move is Cook of the Abyss, with which it wraps its 
arms around a foe, alters its compositional data to 
a suitable finger food and then eats it. Bacchusmon 
also has Party of the Heavens, with which it 
produces a form of alcohol laced with poisons
that can cause drowsiness and paralysis and then 
blasts enemies with the concoction to stupefy them.
Furthermore, the poison data that it produces is 
one subject of the Crank Team's research. There 
are a number of credible rumors that speculate
that Bacchusmon's poison data is linked to the 
development of bacteriological weapons and
high-profile assassination plots."
"digimon_0180_profile","A Digimon that rules over the realm of the dead and 
uses fear and violence to terrorize evil. Plutomon, 
shrouded in deep shadow, stalks through the land 
in search of villains and criminals who deserve to 
be sent to the realm of the dead. Plutomon delights 
in chewing up evildoers with its mouths filled with 
rows of sharp fangs, and lets out a sinister chattering 
noise as it seeks out its prey. The combination of this
and its fearsome appearance frightens even good 
Digimon. Plutomon's abilities all have the disquieting
power to fling villains down to the realm of the dead. 
In one of those moves, Hell's Gate, a giant mouth
appears from the darkness and swallows enemies 
whole, and their data is broken down into scraps. 
The Haggard Cluster move has the fangs of its chest 
release a darkness that absorbs and vaporizes any 
substance in its path. Plutomon shares the goal of 
punishing evil with Jupitermon of the Olympos XII. 
However, there's a longstanding animosity between 
the two because Jupitermon doesn't approve of 
Plutomon's cruel methods."
"digimon_0181_profile","A Deity Digimon and member of the Olympos XII 
that resembles a woman. Mervamon is the form 
of Minervamon that has amassed experience and
achievements over time, and it has a much calmer 
and more mature personality compared to its 
previous form. It has come to pursue elegance 
and charm—observed in abundance in both its 
mannerisms and conduct—and exudes sensuality 
into its surroundings. It even seeks charm in battle, 
performing a refined, graceful dance to fascinate 
those who behold it. That's why more than a few
Digimon become fans of Mervamon upon observing 
this dance. The Love Poison sprayed from the mouth 
of the Medullia on its left arm bewitches any who 
inhale it, letting Mervamon wring the life out of them. 
Madness Merry-Go-Round DX is a spinning slash, 
with its greatsword Olympia Kai and Medullia 
creating a tornado that instantly tears any foe it
touches to shreds."
"digimon_0183_profile","A Deity Digimon with the upper body of a human 
and the lower body of a mountain goat. Aegiomon
is usually affiliated with the same musical troupe
as Sirenmon, reveling in the music by playing the
Syrinx flute hanging from his waist. He loves peace,
and although he dislikes fighting, an unknown
quantity of power dwells within him, and he
demonstrates exceptional combat prowess when
fighting to protect something he cares about.
Aegiomon plays Attract Echo on his Syrinx to draw
the listener's attention, stealing its sense of self and
making it unable to see anything but Aegiomon as it
remains fixated on the tune. This gives other Digimon
the chance to escape or pursue said listener.
Aegiomon's special move is Stun Beat Blow, which
strikes the opponent and discharges the electricity
in Aegiomon's body through his arms, numbing the
enemy's nerves and rendering it unable to move."
"digimon_0184_profile","A Deity Digimon that synthesizes the abilities of 
various species, using a human body as its base. 
This synthesis is said to have resulted from the 
pursuit of the ultimate goal of omnipotence, 
dramatically changing this Digimon's form to match
its environment. This form is based on
Dragon-species data, which would ordinarily lie 
dormant within its body, centered around the crystal
in its chest, but Aegiochusmon manifested this
data onto the surface of its body, establishing it as
armor. This armor is a power suit that's not only for
defense, but which also acts as muscle, dramatically
increasing attack power. Aegiochusmon uses its
special move Bolt Break Knockdown to perform a
punch rush with fists coiled in lightning produced
from its horn, or Lightning Pile to drive a pile-shaped
bolt down on the enemy from above, driving them
into the ground. If this move pierces the enemy once,
subsequently released piles then connect without 
fail, no matter where they're thrown."
"digimon_0185_profile","A Deity Digimon that synthesizes the abilities of 
various species, using a human body as its base. 
This synthesis is said to have resulted from the 
pursuit of the ultimate goal of omnipotence, 
dramatically changing this Digimon's form to 
match its environment. This form is based on
Evil-species data, which would ordinarily lie 
dormant within its body, centered around the 
crystal in its chest, but Aegiochusmon: Dark has
allowed the Evil data to proliferate throughout its 
whole body. The malevolence of Evil types bubbles
forth in both mind and body, causing it to treat 
everything it sees as prey to be hunted. A virus lurks
within the red electricity discharged from its body, 
making this special Digimon a Vaccine-attribute type 
that also creates viruses. It injects the viruses it 
generates into the wounds it inflicts on enemies, 
making for a terrifying attack that destroys victims 
from within. Aegiochusmon: Dark uses its special 
moves Triangler to mince foes with three scythes 
and Plasmadness to shoot dark electricity gathered 
in both hands."
"digimon_0186_profile","A Deity Digimon that synthesizes the abilities of 
various species, using a human body as its base. 
This synthesis is said to have resulted from the 
pursuit of the ultimate goal of omnipotence, 
dramatically changing this Digimon's form to 
match its environment. This form is based on
Angel-species data, which would ordinarily lie 
dormant within its body, centered around the 
crystal in its chest, but Aegiochusmon: Holy has
spread this data throughout its body, and its heart 
is as clear as a pool of reflective water. Using the
shields on its hands, it can channel the 
overwhelming vaccine welling up from within into 
weapons such as short swords or a defensive 
barrier that no Virus data can penetrate.
Aegiochusmon: Holy's special moves are 
Lightning Shower, which rains a barrage of short 
swords down on foes from the sky, and 
Circlet Defense, which generates a defensive 
barrier that repels an enemy's attack. The attack 
is reflected back with an added jolt of electricity, 
making for a powerful counter."
"digimon_0187_profile","A Deity Digimon that synthesizes the abilities of 
various species, using a human body as its base. 
This synthesis is said to have resulted from the 
pursuit of the ultimate goal of omnipotence, 
dramatically changing this Digimon's form to 
match its environment. This form is based on
Android-species data, which would ordinarily lie 
dormant within its body, centered around the 
crystal in its chest, but Aegiochusmon: Blue has
concentrated this data primarily into the upper 
left side of its body. It comes equipped with a 
power-unlocking mechanism characteristic of 
androids, and a lock-on capability that ensures
targets never escape. Aegiochusmon: Blue can 
even detach its giant left arm, known as its 
mechanized power arm, to seek out and attack a 
locked-on enemy before reattaching the arm again. 
Its special move is Penetra-laser, which fires a beam 
from the fingertips of its mechanized power arm. 
When the arm is attached to Aegiochusmon: Blue's 
body, it can use Powered Ignition, which gathers
energy into its palm to unleash at its foe in a
charging blast."
"digimon_0188_profile","A Deity Digimon that synthesizes the abilities of
various species, using a human body as its base.
This synthesis is said to have resulted from the
pursuit of the ultimate goal of omnipotence,
dramatically changing this Digimon's form to
match its environment. This form is based on
Plant-species data, which would ordinarily lie
dormant within its body, centered around the
crystal in its chest, but Aegiochusmon: Green
has affixed the Plant data around its arms and
upper body. Due to its Plant-type base, its body
is dramatically lighter than other forms.
Aegiochusmon: Green is capable of firing sturdy
thorns from the busters equipped to both arms. It
uses these for offense, defense and tricky
maneuvers that utilize them like grapples on
various surfaces. This form is best known for its
agile movements that utilize its equipment and
airy frame. Aegiochusmon: Green's special moves
are Bramble Bite, which summons demonic thorns
that bite into the enemy, and Plant Zone Cradle,
which unleashes countless thorns from its body
to surround foes over a wide area, tearing them to
ribbons."
"digimon_0189_profile","One of the Olympos XII, Ceresmon is a gigantic 
bird Digimon that bears the forest Karpos Hulē on 
its back. Karpos Hulē is where the most delectable 
sweets in the Digital World can be found, and 
many famous fruits grow there as well. With a body 
composed of giant rocks and fertile soil, Ceresmon 
in flight resembles a floating island more than
anything else. Ceresmon Medium, which is 
Ceresmon's true form, resides at the head of the 
island. Ceresmon Medium possesses almost no 
combat ability and rarely appears before others. 
However, on rare occasions, it apparently shows 
itself to those it trusts without bringing along the
giant bird. Ceresmon Medium has a gentle 
personality and a heart overflowing with compassion. 
It offers hungry Digimon fruits from Karpos Hulē, and 
allows injured Digimon to take shelter in the forest
until they've recovered. However, if any prove 
ungrateful for the bounty of nature, bring harm to 
the trees or defile the land for sport, Ceresmon
Medium's nature shifts and it becomes a truly 
frightful forest demon. Ceresmon Medium can 
also use Fruit Flechette, which scatters the unripe
fruits of Karpos Hulē over a wide area. Due to the 
highly concentrated poison they contain, this 
transforms its surroundings into a deathscape of
projectiles and poison. But since this poison 
matures into an excellent fertilizer over the course 
of a few days, areas subject to this attack soon 
grow back in abundance."
"digimon_0190_profile","Because of the antiquated interface on its forehead,
this Beast Digimon is presumed to be an experimental
""Prototype Digimon"" from the time before
Digimon were discovered. Ryudamon is covered
in Japanese-style armor that boasts high defense,
yet its movements are quite nimble, allowing it to
jump in and fight at brazenly close range. The
more it fights, the more it cultivates combat
prowess. Ryudamon possesses gallantry, a
samurai spirit and a soul that renders it unafraid of
powerful enemy Digimon. The data hidden within
the deepest part of its DigiCore during the
experiment contains such fierce combat data as
warlords and dragons from Japanese mythology,
and Ryudamon is thought to possess the potential
to grow into a mighty Digimon. Its special move is
Iai Blade, with which it leaps up to the opponent
to fire an iron blade from its mouth at point-blank
range."
"digimon_0191_profile","A Beast Dragon Digimon with sturdy Japanese-style
armor covering its whole body.
Ginryumon is lighter than it appears, drifting gracefully
through the air and fighting while parrying enemy
attacks with its smooth and extremely tough armor.
It has the courage to fend off enemy attacks with
its own body, and the insight to accurately
perceive said attacks right before they land.
Ginryumon specializes in attacks with outstanding
penetrative ability, and is unflinching in the face
of any enemy Digimon.
Because of the antiquated interface on its forehead,
this Digimon is presumed to be the Digivolution
of an experimental ""Prototype Digimon.""
Ginryumon's special move is Metal Armor Blade,
which impales its foe with an iron lance launched
from its mouth."
"digimon_0192_profile","A Beast Dragon Digimon that soars freely through 
the skies clad in armor of elegantly-shimmering 
scales. Hisyaryumon's form is the result of the 
interface on its forehead unlocking the data 
that lay dormant within its DigiCore of dragons 
and generals—filled with ferocious combat
instincts—from Japanese myths. The orbs it 
clutches are the souls of its lost companions. 
The orb in Hisyaryumon's right hand is the soul of 
Kinryu, while the orb in its left hand is the soul of 
Kakuryu. It's said that each orb contains the data
of a DigiCore hidden within it. Hisyaryumon's 
special move is Legendary Dragon Blade, which
transforms it into a giant steel blade to slice the 
enemy in half with a single stroke."
"digimon_0193_profile","An imaginary Digimon born from the daydream of a 
DigiCore. The interface on Ouryumon's forehead 
miraculously unlocked the creative power of its 
own DigiCore, causing it to Digivolve into this form. 
Perhaps because this DigiCore already contained 
such fierce combat data as warlords and dragons 
from Japanese mythology, the form it dreamed up 
was that of a dragon warrior clad in imposing 
Japanese-style armor, wielding a sword in each 
hand. The blade in Ouryumon's left hand is called 
Gairyu Sadaijin, while the one in its right is named 
Gairyu Udaijin. The blades extending from the 
wings on its back are called the Gaiba Daimeijin. 
Ouryumon's special moves are Eiseiryuojin, which 
unleashes an attack from the blades in both hands, 
and Golden Armor, with which it rages forward with 
the destructive force of a mighty river overflowing 
its banks."
"digimon_0194_profile","A large Digimon equipped with a veritable cache 
of firearms. Many Digimon refer to Gundramon 
as one of the ""Three Musketeers,"" along with
MagnaKidmon and BeelStarmon, due to their 
highly developed marksmanship. It's also a 
member of the Crank Team, and is suited to 
combat much like Machinedramon. Faster than
Machinedramon, though, Gundramon has all 
the mobility it needs to quickly get into firing 
position. The acrid smell of gunpowder has 
soaked into every bit of its fully metallic body, as 
is appropriate for such a bitter and hard-boiled 
Digimon. Gundramon's special moves are Der 
Blitz, which fires at an opponent's vitals with
the twin six-shooters in its hands, and Gewalt 
Schwärmer, which fires off a volley in all 
directions."
"digimon_0195_profile","Referred to as ""Beelzemon Lady"" due to its 
appearance, this Digimon brandishes twin pistols 
with flair. These beloved Rizoma de Loto guns are
like little sisters to the Berenjena, Beelzemon's 
signature pistols. BeelStarmon opens up to anyone
without hesitation—particularly gunslinger Digimon, 
with friends like MagnaKidmon even using the 
nickname ""Beelko."" Still, it's on bad terms with the 
solitary Beelzemon, keeping its distance despite 
recognizing the Evil King Digimon's abilities.
BeelStarmon is clad in a jet-black leather suit, 
and wears a scarf that can transform into weapons, 
armor, wings or anything else the situation warrants. 
Its special move is Fly Bullet, which homes in on 
the enemy's vitals with shots from its Rizoma de
Loto."
"digimon_0196_profile","A British punk Digimon born when the ultimate 
British hacker injected all of his knowledge into 
a computer virus, thereby causing it to mutate.
Pukumon may be small, but its rebellious 
personality is second to none in the Digital 
World. It always picks fights, no matter how 
much stronger or weaker its potential opponent 
may be. Although Pukumon is the type to settle 
disputes with a slugfest, its special move Needle
Squall acts as a trump card by launching all the 
super-hard thorns on its Chrondigizoid head 
at once."
