key,text
"digimon_0001_profile","A Puppet Digimon that has concealed itself inside 
a stuffed animal shaped like Tyrannomon. Why 
exactly this mysterious Digimon chose a stuffed
Tyrannomon is unclear, but it probably just hid 
inside whatever plush toy was nearby. Whatever 
the explanation, this stuffed Tyrannomon has all 
the offensive and defensive power of Monzaemon, 
meaning no ordinary Digimon can stand up to it.
However, just like Monzaemon, it's nothing more 
than an ornament without someone to pull its 
strings. Its special move is Pretty Attack, which
emanates from its adorable body."
"digimon_0002_profile","A Mammal Digimon resembling a rabbit, born from 
the fusion of moon observation data. Its large ears 
can recognize sounds from any distance. Although 
timid, Lunamon often gets lonely and easily grows 
attached to others. It uses its special move 
Tearing Shot to concentrate power into the antenna 
on its forehead to shoot a beautiful orb of water at 
the enemy."
"digimon_0003_profile","A Beast Man Digimon with astounding jumping 
capabilities that likes to toy with its foes using 
speedy movements. Lekismon's nature is as 
ephemeral as the phases of the moon, and its 
appearance is somewhat mystical. It uses its 
special move Moon Night Bomb to hurl hypnotic
water bubbles generated from the Moon Gloves 
on its hands and put the enemy to sleep."
"digimon_0004_profile","A Wizard Digimon with a flexible body, enabling it 
to dispatch foes with graceful movements. It
specializes in highly fluid fighting styles, and is 
said to double in power when bathed in the light of
the moon. Its special move, Lunatic Dance, entrances
opponents with rhythmic steps, allowing it to close
in and deliver a two-handed slash with its weapons
Nova Luna."
"digimon_0005_profile","A Rock/Mineral Digimon discovered when 
performing digital analysis of an ancient curse. It 
has forbidden incantations in an archaic script
signifying ""plague,"" ""curse"" and ""evil""
inscribed on its back, apparently meant to 
safeguard it from the gas it emits. Approximately
90% of its body is composed of rock data, and
it survives by binding up its limbs. An emotionless
Digimon that doesn't act unless so ordered."
"digimon_0006_profile","The decrepit ruins of what was once a Dark Angel 
Digimon that fell into the Dark Area in its pursuit of 
strength and destruction. There, SkullSatamon's 
wicked nature intensified, and its dark powers are
now unfathomable. Its DigiCore, concentrated with 
these dark powers, has transformed into a DarkCore,
something only possessed by Evil-species Digimon.
SkullSatamon's special move Nail Bone is a
horrifying technique that unleashes an intense light
from the jewel on the tip of its staff, disrupting and
obliterating its opponent's data."
"digimon_0009_profile","A mutant Machine Digimon shaped like a gear. 
There are also countless other gears built into its 
body that are constantly turning. If even one gear 
is removed, all of the others stop spinning and 
Hagurumon ceases to function. Hagurumon 
possesses the ability to infect foes with a computer
virus that allows it to control them. Thus, Digimon
of wicked intent often seek to exploit Hagurumon's
powers. But since it lacks any sense of self, it has
no way of knowing it's being used for evil. Its
special move is Cog Crusher, which implants a
black gear loaded with a computer virus into its
opponent's body, causing them to go berserk."
"digimon_0010_profile","A Fire Digimon whose body is cloaked in crimson 
flames. Generated of the Firewall built to defend 
against illegal intrusions from the Internet, this 
Digimon has a violent temperament that reflects 
its blazing appearance and seeks to incinerate
anything it touches. Its flames burn more intensely 
than those of its kindred on File Island, making it
an extremely difficult Digimon to tame. But even if 
tamed, there's no telling when Meramon will turn 
on its master. Meramon uses its special move 
Burning Fist to cause its arms to flare up before 
punching its foe."
"digimon_0011_profile","A Mythical Beast Digimon with gigantic wings. 
Airdramon is an exceptionally valuable monster,
thought to be near in stature to a god. It specializes
in aerial combat, invoking storms with its roar and
creating colossal whirlwinds by flapping its wings.
Though quite vicious by nature, Airdramon is also
very intelligent. Nevertheless, any average Tamer
would find it nearly impossible to control. Airdramon
beats its huge wings to unleash a cutting vacuum
blade with its special move Spinning Needle."
"digimon_0012_profile","A wolf-like Beast Digimon with a pale silver pelt. 
Garurumon's fur is said to be as hard as the 
legendary rare metal Mithril, and the blades
extending from its shoulders are sharp enough to 
slice through anything they touch. Possessed of a
physique honed in the frozen tundra and a fierce 
instinct for conflict, Garurumon is feared by other 
Digimon for its predatory agility and unerring 
accuracy in bringing down its prey. However, it's 
also incredibly intelligent and steadfastly loyal to 
any it acknowledges as its leader. Garurumon uses 
its special move Fox Fire to breathe out a stream 
of intense blue flames."
"digimon_0013_profile","A Ghost Digimon with a cloth draped over it. 
Bakemon is a wicked being born of darkness, and 
is said to instantly destroy the systems of any 
computers it possesses. What lies beneath the 
cloth is a complete mystery, and there are theories 
that the shadow cast under its body is a black hole. 
Bakemon lacks combat power and thus prefers not 
to attack its foes directly. Its special move 
Death Charm casts a powerful curse. Those lacking 
strong mental fortitude die in a matter of seconds 
under its effect."
"digimon_0014_profile","A star-shaped Digimon discovered by chance in 
planetary analysis software at a space 
development center. Starmon is a space warrior 
with stellar armor, wearing gloves and boots 
emblazoned with stars. Its tattered yellow scarf 
speaks to the many battles it's survived, and its
eyes burn with fighting spirit. Its eyes can even
be used in a more advanced manner to
hypnotize opponents. This hot-blooded
Digimon has a fierce admiration for the brave
Leomon. Starmon's special move Meteor Shower
rains down small meteors upon the heads of
its foes."
"digimon_0015_profile","A Giant Bird Digimon with a pair of enormous horns 
on its head. Known as the ""Great Eagle of the
Desert,"" Aquilamon soars through the sky at Mach 
speed and can spot distant foes with its keen 
eyesight. Its horns display tremendous force when 
Aquilamon swoops down to ram into enemies. 
While many Bird Digimon are savagely brutal,
Aquilamon values decorum and obeys those it 
pledges allegiance to without fail. It slams into foes 
from above with its special move Glide Horn."
"digimon_0016_profile","A ""Commando Dragon"" that seeks to become a 
Virus Buster. While Strikedramon still has many 
vestiges of Monodramon, such as the horn jutting 
out of the back of its head, it has so transformed 
its appearance into a Commando-Mode Digimon 
covered in metal plating that it now resembles a 
completely different species. Despite being an 
inherently kindhearted Digimon, should it happen
upon a Virus-attribute type, Strikedramon becomes 
consumed by an instinct to exterminate and 
doesn't stop fighting until its opponent's data has 
been reduced to dust. It uses its special move 
Fang Strike to heat its metal plating to red-hot 
levels, turning itself into a mass of flame and 
tackling the opponent in a fearsome maneuver."
"digimon_0017_profile","A Dark Digimon possessing strong Dark Side 
Power. Minotarumon's movements are slow, but it 
has an extremely tough hide that leaves it unfazed 
by regular attacks. Its special move Darkside Quake
uses the Demon Arm attached to its left arm to
cause a massive earthquake. The attack sends
shockwaves over a wide area, making escape
impossible no matter how far enemies run."
"digimon_0019_profile","An imaginary Digimon born from the daydream of 
a DigiCore. The interface on Dorugoramon's 
forehead miraculously unlocked the creative 
power of its own DigiCore, causing it to Digivolve 
into this form. Perhaps because this DigiCore 
already contained powerful draconic data, the 
form it dreamed up was that of an avatar of 
powerful destruction and the very incarnation of 
the ""ultimate enemy."" Dorugoramon uses its 
special move Brave Metal to unleash a dreadful 
charge with all the power of body and soul, and 
DORU-Din to release a shockwave of destruction."
"digimon_0020_profile","A mouse-like Digimon that's always filling Sukamon's
head with shady ideas. Chuumon has a
solid friendship with Sukamon (although
perhaps it's only Chuumon that sees things that
way). The relationship started when Chuumon was 
nearly caught in a network system trap named 
""Carnivore,"" only to be rescued by Sukamon, who 
just happened to be passing by. Fundamentally a 
coward, Chuumon is unrivaled in its slyness and 
takes off like a shot at the slightest hint of danger. 
Its special move Cheese Bomb hurls a cheese-
shaped explosive. Anyone who makes the mistake
of eating one of these is in for a nasty surprise."
"digimon_0021_profile","A gigantic Digimon that dwells in the depths of the 
Net Ocean. Its huge size ranks it among the largest 
of all Digimon in the Digital World. In fact, Whamon
is so enormous that normal computers can't
process the sheer volume of data that it's comprised
of. Similar species have been confirmed in the
waters near File Island, but Whamon, which lives
along the coast of the Folder Continent, boasts
attack strength and vitality superior to its kin,
having Digivolved to its Ultimate form. Its special
move Tidal Wave creates a massive tsunami that
destroys everything in its path."
"digimon_0023_profile","A Mutant Digimon that DNA Digivolved from 
Stingmon and ExVeemon. A chimera of a dragon 
and an insect, this Digimon is known as the 
""Terrible Bee."" While Dinobeemon can't be easily 
classified as either a Dragon or an Insectoid type, 
its insect qualities are quite prominent. Flying 
through the air on its four wings, this Digimon 
tracks its foes unerringly with its compound eyes
before choking the life out of them with harsh 
certainty. Dinobeemon is also exceedingly 
barbaric by nature. It uses its special move
Hell Masquerade to perform a “dance of Hell,”
cutting through foes with movements fast
enough to leave afterimages."
"digimon_0024_profile","A seldom-seen Pixie Digimon that dwells in the
Net Ocean. Despite the ""Angemon"" in its name, it's
actually completely distinct from the Angemon
species in terms of its ecosystem. The ring around
MarineAngemon's neck is called a ""Holy Ring,""
causing speculation that it has some relation to
holy Digimon such as Gatomon or Angewomon,
who also wear such rings. The characters
inscribed on its ring have yet to be deciphered.
Though MarineAngemon generally avoids combat,
its special move Ocean Love causes foes to lose
the will to fight, thereby guaranteeing victory."
"digimon_0025_profile","An Android Digimon modeled after a feral Digimon 
with predatory instincts that enable it to reliably
bring down prey. Raptordramon boasts an incredibly
tough body as well as uncontrollable savagery, and
so it has been remodeled with pure Chrondigizoid
Metal of considerable weight to restrict its mobility.
Nevertheless, it still possesses exceptional explosive
power and flight capabilities, largely due to the feral
Digimon it used to be prior to remodeling.
Though small, Raptordramon is capable of taking
down even ultra-large Digimon in a single blow if
it can gradually unlock its abilities.
It performs its special move Ambush Crunch by
pouncing on the enemy and biting vitals with its
sharp fangs."
"digimon_0026_profile","Grademon is a Warrior Digimon known as the 
""Golden Meteor,"" due to the courageous way it 
smashes through the vanguard of the enemy. It 
exhibits blazing speed when using its ""Twin Blade 
of the Dragon King"" in tandem, but the truth is, the 
swords bear an irrepressible curse that forces the
wielder into a berserker frenzy. Though not as
powerful overall, Grademon's swordsmanship is 
believed to surpass that of LordKnightmon of the 
Royal Knights. The royal blue cape Grademon wears is
also a badge of honor bestowed for its meritorious 
deeds in many battles. Its special move is Cross Blade, 
a swift sword technique that cleaves through the
enemy in a cross-shaped pattern."
"digimon_0027_profile","The strongest dragon warrior, wearing armor 
crafted from the super-metal Chrondigizoid, 
WarGreymon is the ultimate form of the Greymon 
species. It sports a more humanoid physique than 
the typical large bodies of other Greymon types, 
but possesses vastly improved power and speed. 
It may be impossible to defeat with the attacks of 
Ultimate-level Digimon. The ""Dramon Killers"" 
attached to WarGreymon's arms deal massive 
damage to Dramon-species Digimon, but also 
expose WarGreymon to danger, making them 
double-edged swords. WarGreymon can also 
combine the exoskeleton parts on its back to form 
the hardest of shields, ""Brave Shield."" It's said that 
even among the most battle-hardened of veterans, 
it's only when one of true valor realizes its own 
destiny that it Digivolves into a WarGreymon. 
WarGreymon's special move is the super dense, 
high temperature energy beam Terra Force, with 
which it concentrates all the energy in the 
atmosphere into a single point before blasting it
forward. It also uses Great Tornado to join the 
Dramon Killers on its arms above its head to 
perform a spinning, high-speed charge that
pierces the enemy."
"digimon_0028_profile","A Mutant Digimon that acts as the boss of the 
Mamemon, and sometimes referred to as the
""Smiley Bomber."" Some believe that BigMamemon
is actually an aggregation of Mamemon. Though
normal Mamemon are about the same size as
In-Training Digimon, they pack more power into
their small frames than appearances would imply. 
BigMamemon, on the other hand, lives up to its 
name by being dozens, if not hundreds, of times 
larger than its smaller kin. At this size, why it's 
still referred to as ""Mamemon,"" named for its small 
stature, is unclear. BigMamemon has a warm, 
gentle personality, and isn't fond of conflict or 
battle. It can always be found playing with its 
Mamemon followers. Its special move 
Big Smiley Bomber uses the Mamemon under its 
command as weapons. BigMamemon is said to 
shrink in size after using this technique."
"digimon_0030_profile","Sangloupmon is a bloodsucking wolf Digimon with 
a noble demeanor. It's one of the oldest species of 
Digimon, said to have survived since the dawn of 
the Digital World. Digimon who have their blood 
sucked by Sangloupmon have all the data drained
from their DigiCores, causing them to perish, as 
they can no longer maintain vital functions. 
Sangloupmon is capable of teleporting to other 
locations instantly by disassembling its own data 
into packets and sending them across the Net. Its 
special move is Sticker Blade, which fires off a 
spray of thousands of minute blades to skewer 
opponents in the blink of an eye."
"digimon_0031_profile","A bloodsucking martial artist Digimon that performs
a magnificent dance. Said to have been born in
the folk dance database of a certain museum,
Matadormon is a master of the Bulldog Dance,
performing it with a unique arrangement of rhythmic
movements. It uses its fluttering garments to
befuddle foes, slashing those who let their guard
down with the countless rapiers hidden inside the
deceptively soft cloth of its sleeves. As a vampire,
Matadormon must sustain itself by drinking Digimon
blood, but not just any will do, and so it wanders
from land to land in search of strong Digimon to
feed upon. Its special move is Earth-Shattering Stomp,
a vicious kicking attack drawing upon Matadormon's
own original martial arts style."
"digimon_0032_profile","A Dark Beast Digimon known as ""the king of all
vampire Digimon."" GranDracmon has long
maintained its own castle in the Dark Area, and is
said to boast such immense might that not even the
Seven Great Demon Lords dare meddle with it. With
a well-bred demeanor and a voice laced with
bewitching glamor, GranDracmon can be devilishly
charming, and there are numerous tales of Angel
Digimon sent to slay it that ended up being seduced
to the dark side. Its special moves are Crystal
Revolution, which flash-freezes all foes into ice
crystals, and Eye of the Gorgon, which turns its evil
gaze on the enemy, trapping its heart in darkness."
"digimon_0033_profile","A bipedal Ceratopsian Digimon resembling a 
triceratops, with all the combat power of that 
mighty herbivorous dinosaur. Its hide is among the 
toughest of all biological Digimon. Similarly, the 
two ultra-hard horns on its forehead are much 
more solid than Monochromon's horn. Though 
generally placid by nature, Triceramon's charging 
attack belies its slow movements, and packs 
enough destructive force to shatter even the 
sturdy bodies of Mineral Digimon. It uses its 
special move Tri-Horn Attack to ram into enemies
with the horns on its forehead and snout."
"digimon_0034_profile","One of the Seven Great Demon Lords, this Evil King
Digimon takes the form of a woman. Believed to
have at one time been an Ophanimon, Lilithmon
fell from grace and became what's known as the
""Goddess of Darkness."" Beguiling and beautiful, it
seduces its foes, with certain death said to await all
who accept its invitation. In keeping with its
""Goddess of Darkness"" moniker, Lilithmon rewards
vice with generosity and virtue with cruel indignities.
The fiendish ""Nazar Nails"" on its right hand corrode
anything they touch. Lilithmon's special move is
Phantom Pain, a dark breath attack that eats away
at foes' bodies. Those afflicted by this curse find
their data eroding, starting with their extremities,
and they suffer painfully even after their inevitable
demise."
"digimon_0035_profile","Beelzemon is an Evil King Digimon that prizes its 
independence, despite having the ability to rule over
many Evil-species Digimon. One of the Seven Great
Demon Lords, Beelzemon is said to be capable of
becoming the foremost Nightmare Soldier should it
so desire, but it's also rumored that there's another
Evil King Digimon whose power surpasses even
Beelzemon's. Beelzemon always keeps its beloved
shotguns, the Berenjena, close at hand, and it rides
around on its giant motorcycle machine Behemoth.
It has a cruel and ruthless personality, but due to its
pride, it never appears in groups or attacks the weak.
Its signature move is Darkness Claw, with which it
raises its sharp claws into the air and then slices
through its foe. Its special move, Double Impact,
involves firing twin blasts from its two shotguns."
"digimon_0036_profile","One of the Seven Great Demon Lords, this Evil King
Digimon is shaped like an old man with a long
beard. Barbamon exists in the heart of the den of
evil known as the Dark Area, controlling Dark Angel
Digimon and causing them to engage in all sorts of
wickedness. It's obsessed with all the treasures of
the network, using every means at its disposal to
sate its greed. This rapacious and ruthless creature
would kill a Digimon for even a scrap of treasure.
The most cunning tactician of the Seven Deadly
Digimon, it controls not only Dark Angel Digimon,
but even the Mega-level Ghoulmon with ease.
Barbamon's special moves are Death Lure, a
demonic staff that tempts Digimon into an
inescapable living hell and converts them to
wickedness, and Pandemonium Lost, which
releases all the evil energy of the Dark Area at once,
burning everything with a super high-temperature
explosion. Even MaloMyotismon's special move
Pandemonium Flame releases only the smallest
fraction of this energy."
"digimon_0037_profile","Fear of the excessive power in Leviamon's
possession has earned it the moniker of ""Devil
Beast,"" and it's counted among the Seven Great
Demon Lords. A grand creature with a maw large
enough to swallow the entire Digital World, it's said
to sleep in the Net Ocean near the Dark Area. If
awoken, Leviamon looks down on any Digimon in
positions of might, causing not only other Evil King
Digimon to flee in terror, but even Angel Digimon as
well. There are limits to what can be determined
about this Digimon, however, and it almost never
appears. It's considered a primordially evil existence
that has taken up residence in the Digital World. It
can use its special move Biting Crush to destroy
everything in its path with its massive jaws, or Tail
Strike to pulverize enemies with its long tail."
"digimon_0038_profile","An Evil King Digimon with many Evil-species and 
Dark Angel Digimon under its command. 
Creepymon was originally an Angel Digimon, and 
one of quite high rank at that. However, it resorted
to rebellion—or perhaps violence—against the 
personifications of the Digital World's goodness
(which may have been the very humans who built it), 
and was thus deleted to the Dark Area (the 
graveyard of erased data). Creepymon and its ilk 
have vowed to one day subjugate the Digital World 
and exact revenge upon these personifications of
goodness. It uses its special move Flame Inferno to 
blast enemies with superheated hellfire. Anyone hit 
by this attack is incinerated without a trace."
"digimon_0039_profile","Both divine and diabolical, this Ultimate Evil King
Digimon is the strongest of the Seven Great Demon
Lords. Lucemon: Chaos Mode instigated a rebellion
in ancient times, and was sealed away in the Dark
Area along with many other Evil King Digimon. Its
power exceeds that of Mega Digimon, so much so
that it even rivals the entity considered ""God.""
Although it has a godlike side that cherishes all living
things, it also has a demonic side that wants to
annihilate the world itself. This is why it aims to
destroy this world and build a new one in its stead.
Its special move Paradise Lost launches its enemy
high into the air with a wild barrage before it grabs
its limbs and slams it into the ground, while Dead or
Alive seals the enemy within a three-dimensional
magic circle made from holy and evil spheres. Those
caught in this magic circle have a 50/50 chance of
either being completely obliterated or taking heavy
damage."
"digimon_0040_profile","Belphemon awakes from its constant slumber once
every thousand years and returns to its original form.
It transforms into an avatar of rage once awakened,
and everything in its field of vision is subject to
destruction. Digimon of Ultimate level or lower who
hear Belphemon: Rage Mode's roar face instant
death from data fragmentation, and not even Mega
Digimon can escape unharmed. It uses its special
move Lampranthus to shoot black flames from the
chains coiled around its body, and Gift of Darkness
to cleave with claws enveloped in infernal flames.
Also, the data of Digimon killed by that which rules
over the Seven Great Demon Lords isn't reincarnated,
going instead to the Dark Area to act as flesh and
blood for Evil Kings."
"digimon_0041_profile","A Puppet Digimon that resembles a panda. 
Pandamon's expressionless gaze, together with its 
abrupt and dismissive personality, rob it of any
cuteness it might otherwise have. It likes to think 
of itself as a lone wolf, but it's secretly jealous of
Monzaemon, a popular Digimon with a similar look.
Still, Pandamon is surprisingly capable in battle,
and is quick to send any who disturb it packing.
The Pandamon population is small, making it a
rare sight. Its special move is Animal Nail, an
attack with the claws normally kept hidden in
its paws."
"digimon_0042_profile","An Insectoid Digimon affiliated with the mysterious
Royal Base, a secret floating honey base.
While its daily life may differ from that of other
Insectoid Digimon, FunBeemon has a cheery
disposition and is a hard worker of considerable
strength. It always gets along with Vegetation
Digimon like Palmon or Lillymon. The Royal Base
is under constant construction, and Funbeemon's
mission requires it to collect field data such as
flowers or plants a little at a time as building
materials. It's therefore classified as having the
Virus attribute. The base is also guarded by
powerful Digimon that prevent any from drawing
near, so the purpose of the construction remains
a mystery. FunBeemon's special move is Gear
Stinger, an attack that fires off a rapid volley of
tiny, serrated stingers."
"digimon_0043_profile","A Virus Gatomon with striking black fur. 
BlackGatomon is the quintessential child of evil, 
spendings its days wandering through eerie 
darkness. An extremely rare mutation of Gatomon, 
very few are thought to exist. BlackGatomon is
malicious and prideful and loves picking on the 
weak—all in all a problematic Digimon. As a Dark
Digimon, it generally Digivolves into a Dark Angel 
Digimon. Just like Gatomon, BlackGatomon's 
special move is Lightning Paw."
"digimon_0044_profile","CatchMamemon is a Mutant Digimon that Digivolved 
from Mamemon when it fused with data from file 
management software. Purposeful and sometimes
obstinate, CatchMamemon considers caring for 
Digi-Eggs to be its chief task. If need be, it can move 
around without floating by using its giant arms to 
walk. If the slot machine on CatchMamemon's 
chest rolls a triple seven as it grabs onto a foe, it 
transforms that Digimon into a bomb using Miracle 
Bomb, then uses the transformed enemy to attack. 
The force of the resulting explosion is said to be 
equal to the strength of the captured Digimon."
